{
  "$schema": "../schema/v1/deployment-evidence.schema.json",
  "schemaVersion": "1.0.0",
  "network": "testnet",
  "apiBaseUrl": "https://api.testnet.hiro.so",
  "deployer": "ST1BK6TFDEJ4TBVWH5SHNB6SPNWGY06YZFG9WMM4P",
  "evidence": {
    "source": "confirmed-receipts",
    "capturedAt": "2026-07-22T00:00:00Z",
    "gitCommit": "0000000000000000000000000000000000000000",
    "planPath": "deployments/full-system.testnet-plan.yaml",
    "planSha256": "0000000000000000000000000000000000000000000000000000000000000000"
  },
  "contracts": [
    {
      "name": "example-contract",
      "principal": "ST1BK6TFDEJ4TBVWH5SHNB6SPNWGY06YZFG9WMM4P.example-contract",
      "publishTxId": "0x1111111111111111111111111111111111111111111111111111111111111111",
      "interface": {
        "required": true,
        "expectedContractName": "example-contract",
        "expectedFunctions": [
          "get-version"
        ]
      },
      "readOnlyChecks": [
        {
          "function": "get-version",
          "sender": "ST1BK6TFDEJ4TBVWH5SHNB6SPNWGY06YZFG9WMM4P",
          "arguments": [],
          "expectedResultHex": "0x0701"
        }
      ]
    }
  ]
}
